{
  "task_id": "demo_v1",
  "page_id": "demo_page",
  "page_name": "Demo Page",
  "input": {
    "source_type": "html",
    "html_entry": "input/index.html",
    "assets_dir": "input/assets",
    "notes_file": "input/notes.md"
  },
  "target": {
    "profile": "../../../profiles/sim_1280x800.json",
    "viewport": {
      "width": 1280,
      "height": 800
    },
    "color_depth": 32,
    "dpi": 160,
    "language": "zh-CN"
  },
  "generation": {
    "output_c": "generated/demo_page_page.c",
    "output_h": "generated/demo_page_page.h",
    "component_mode": "portable",
    "allow_custom_draw": false,
    "allow_freetype": false,
    "allow_filesystem_assets": false
  },
  "reference": {
    "image": "reference/reference.png",
    "render_from_html": true
  },
  "validation": {
    "pixel_diff_threshold": 16,
    "max_diff_ratio": 0.18,
    "max_mean_abs_diff": 22.0,
    "require_size_match": true
  },
  "export": {
    "bundle_dir": "export/portable_bundle",
    "include_assets": true,
    "include_porting_md": true
  },
  "failure_policy": {
    "max_iterations": 8,
    "stop_on_build_error": true,
    "stop_on_missing_reference": true,
    "stop_on_validation_script_error": true,
    "stop_on_portability_error": true
  },
  "compat": {
    "legacy_page_flow_task": null
  },
  "notes": [
    "Fill input/index.html with the target page HTML.",
    "Replace the simulator profile with the real board profile before export."
  ]
}
